{
  "$schema": "https://docs.wrangles.com/registry/schema/catalog-snapshot.schema.json",
  "format": "wrangles-catalog-snapshot",
  "format_version": "0.1",
  "source": {
    "system": "API Core",
    "repository": "https://github.com/wrangleworks/API-Core",
    "table": "public.wrangles_catalog",
    "data_updated_through": "2026-10-18T10:01:30Z"
  },
  "entry_count": 153,
  "entries": [
    {
      "catalog_id": "149",
      "catalog_key": "ai.answers",
      "kind": "wrangle",
      "wrangle_key": "ai.answers",
      "runtime_key": "ai.answers",
      "title": null,
      "registry_path": null,
      "status": "active",
      "source": "API Core",
      "created_at": "2026-10-18T10:01:30Z",
      "updated_at": "2026-10-18T10:01:30Z"
    },
    {
      "catalog_id": "150",
      "catalog_key": "ai.choose",
      "kind": "wrangle",
      "wrangle_key": "ai.choose",
      "runtime_key": "ai.choose",
      "title": null,
      "registry_path": null,
      "status": "active",
      "source": "API Core",
      "created_at": "2026-10-18T10:01:30Z",
      "updated_at": "2026-10-18T10:01:30Z"
    },
    {
      "catalog_id": "151",
      "catalog_key": "ai.score",
      "kind": "wrangle",
      "wrangle_key": "ai.score",
      "runtime_key": "ai.score",
      "title": null,
      "registry_path": null,
      "status": "active",
      "source": "API Core",
      "created_at": "2026-10-18T10:01:30Z",
      "updated_at": "2026-10-18T10:01:30Z"
    },
    {
      "catalog_id": "152",
      "catalog_key": "ai.true_false",
      "kind": "wrangle",
      "wrangle_key": "ai.true_false",
      "runtime_key": "ai.true_false",
      "title": null,
      "registry_path": null,
      "status": "active",
      "source": "API Core",
      "created_at": "2026-10-18T10:01:30Z",
      "updated_at": "2026-10-18T10:01:30Z"
    },
    {
      "catalog_id": "153",
      "catalog_key": "convert.parse",
      "kind": "wrangle",
      "wrangle_key": "convert.parse",
      "runtime_key": "convert.parse",
      "title": null,
      "registry_path": null,
      "status": "active",
      "source": "API Core",
      "created_at": "2026-10-18T10:01:30Z",
      "updated_at": "2026-10-18T10:01:30Z"
    },
    {
      "catalog_id": "154",
      "catalog_key": "search.ai_mode",
      "kind": "wrangle",
      "wrangle_key": "search.ai_mode",
      "runtime_key": "search.ai_mode",
      "title": null,
      "registry_path": null,
      "status": "active",
      "source": "API Core",
      "created_at": "2026-10-18T10:01:30Z",
      "updated_at": "2026-10-18T10:01:30Z"
    },
    {
      "catalog_id": "69",
      "catalog_key": "accordion",
      "kind": "wrangle",
      "wrangle_key": "accordion",
      "runtime_key": "accordion",
      "title": null,
      "registry_path": null,
      "status": "active",
      "source": "API Core",
      "created_at": "2026-09-16T08:41:16Z",
      "updated_at": "2026-09-23T16:47:58Z"
    },
    {
      "catalog_id": "70",
      "catalog_key": "batch",
      "kind": "wrangle",
      "wrangle_key": "batch",
      "runtime_key": "batch",
      "title": null,
      "registry_path": null,
      "status": "active",
      "source": "API Core",
      "created_at": "2026-09-16T08:41:16Z",
      "updated_at": "2026-09-23T16:47:58Z"
    },
    {
      "catalog_id": "71",
      "catalog_key": "classify",
      "kind": "wrangle",
      "wrangle_key": "classify",
      "runtime_key": "classify",
      "title": null,
      "registry_path": null,
      "status": "active",
      "source": "API Core",
      "created_at": "2026-09-16T08:41:16Z",
      "updated_at": "2026-09-23T16:47:58Z"
    },
    {
      "catalog_id": "72",
      "catalog_key": "clean_whitespaces",
      "kind": "wrangle",
      "wrangle_key": "clean_whitespaces",
      "runtime_key": "clean_whitespaces",
      "title": null,
      "registry_path": null,
      "status": "active",
      "source": "API Core",
      "created_at": "2026-09-16T08:41:16Z",
      "updated_at": "2026-09-23T16:47:58Z"
    },
    {
      "catalog_id": "1",
      "catalog_key": "compare.lists",
      "kind": "wrangle",
      "wrangle_key": "compare.lists",
      "runtime_key": "compare.lists",
      "title": null,
      "registry_path": null,
      "status": "active",
      "source": "API Core",
      "created_at": "2026-09-16T08:41:16Z",
      "updated_at": "2026-09-23T16:47:58Z"
    },
    {
      "catalog_id": "2",
      "catalog_key": "compare.text",
      "kind": "wrangle",
      "wrangle_key": "compare.text",
      "runtime_key": "compare.text",
      "title": null,
      "registry_path": null,
      "status": "active",
      "source": "API Core",
      "created_at": "2026-09-16T08:41:16Z",
      "updated_at": "2026-09-23T16:47:58Z"
    },
    {
      "catalog_id": "3",
      "catalog_key": "compute.case_when",
      "kind": "wrangle",
      "wrangle_key": "compute.case_when",
      "runtime_key": "compute.case_when",
      "title": null,
      "registry_path": null,
      "status": "active",
      "source": "API Core",
      "created_at": "2026-09-16T08:41:16Z",
      "updated_at": "2026-09-23T16:47:58Z"
    },
    {
      "catalog_id": "4",
      "catalog_key": "compute.score_search_results",
      "kind": "wrangle",
      "wrangle_key": "compute.score_search_results",
      "runtime_key": "compute.score_search_results",
      "title": null,
      "registry_path": null,
      "status": "active",
      "source": "API Core",
      "created_at": "2026-09-16T08:41:16Z",
      "updated_at": "2026-09-23T16:47:58Z"
    },
    {
      "catalog_id": "73",
      "catalog_key": "concurrent",
      "kind": "wrangle",
      "wrangle_key": "concurrent",
      "runtime_key": "concurrent",
      "title": null,
      "registry_path": null,
      "status": "active",
      "source": "API Core",
      "created_at": "2026-09-16T08:41:16Z",
      "updated_at": "2026-09-23T16:47:58Z"
    },
    {
      "catalog_id": "103",
      "catalog_key": "connector.access",
      "kind": "connector",
      "wrangle_key": null,
      "runtime_key": "access",
      "title": null,
      "registry_path": null,
      "status": "active",
      "source": "API Core",
      "created_at": "2026-10-09T14:06:47Z",
      "updated_at": "2026-10-09T14:06:47Z"
    },
    {
      "catalog_id": "104",
      "catalog_key": "connector.akeneo",
      "kind": "connector",
      "wrangle_key": null,
      "runtime_key": "akeneo",
      "title": null,
      "registry_path": null,
      "status": "active",
      "source": "API Core",
      "created_at": "2026-10-09T14:06:47Z",
      "updated_at": "2026-10-09T14:06:47Z"
    },
    {
      "catalog_id": "105",
      "catalog_key": "connector.ckan",
      "kind": "connector",
      "wrangle_key": null,
      "runtime_key": "ckan",
      "title": null,
      "registry_path": null,
      "status": "active",
      "source": "API Core",
      "created_at": "2026-10-09T14:06:47Z",
      "updated_at": "2026-10-09T14:06:47Z"
    },
    {
      "catalog_id": "106",
      "catalog_key": "connector.ckan.download",
      "kind": "connector",
      "wrangle_key": null,
      "runtime_key": "ckan.download",
      "title": null,
      "registry_path": null,
      "status": "active",
      "source": "API Core",
      "created_at": "2026-10-09T14:06:47Z",
      "updated_at": "2026-10-09T14:06:47Z"
    },
    {
      "catalog_id": "107",
      "catalog_key": "connector.ckan.upload",
      "kind": "connector",
      "wrangle_key": null,
      "runtime_key": "ckan.upload",
      "title": null,
      "registry_path": null,
      "status": "active",
      "source": "API Core",
      "created_at": "2026-10-09T14:06:47Z",
      "updated_at": "2026-10-09T14:06:47Z"
    },
    {
      "catalog_id": "147",
      "catalog_key": "connector.concatenate",
      "kind": "connector",
      "wrangle_key": null,
      "runtime_key": "concatenate",
      "title": null,
      "registry_path": null,
      "status": "active",
      "source": "API Core",
      "created_at": "2026-10-09T14:06:47Z",
      "updated_at": "2026-10-09T14:06:47Z"
    },
    {
      "catalog_id": "108",
      "catalog_key": "connector.concurrent",
      "kind": "connector",
      "wrangle_key": null,
      "runtime_key": "concurrent",
      "title": null,
      "registry_path": null,
      "status": "active",
      "source": "API Core",
      "created_at": "2026-10-09T14:06:47Z",
      "updated_at": "2026-10-09T14:06:47Z"
    },
    {
      "catalog_id": "148",
      "catalog_key": "connector.dataframe",
      "kind": "connector",
      "wrangle_key": null,
      "runtime_key": "dataframe",
      "title": null,
      "registry_path": null,
      "status": "active",
      "source": "API Core",
      "created_at": "2026-10-09T14:06:47Z",
      "updated_at": "2026-10-09T14:06:47Z"
    },
    {
      "catalog_id": "109",
      "catalog_key": "connector.duckdb",
      "kind": "connector",
      "wrangle_key": null,
      "runtime_key": "duckdb",
      "title": null,
      "registry_path": null,
      "status": "active",
      "source": "API Core",
      "created_at": "2026-10-09T14:06:47Z",
      "updated_at": "2026-10-09T14:06:47Z"
    },
    {
      "catalog_id": "110",
      "catalog_key": "connector.excel.columns",
      "kind": "connector",
      "wrangle_key": null,
      "runtime_key": "excel.columns",
      "title": null,
      "registry_path": null,
      "status": "active",
      "source": "API Core",
      "created_at": "2026-10-09T14:06:47Z",
      "updated_at": "2026-10-09T14:06:47Z"
    },
    {
      "catalog_id": "111",
      "catalog_key": "connector.excel.selected_data",
      "kind": "connector",
      "wrangle_key": null,
      "runtime_key": "excel.selected_data",
      "title": null,
      "registry_path": null,
      "status": "active",
      "source": "API Core",
      "created_at": "2026-10-09T14:06:47Z",
      "updated_at": "2026-10-09T14:06:47Z"
    },
    {
      "catalog_id": "112",
      "catalog_key": "connector.excel.sheet",